product_id,sku,name,description,category,price
230,SKU-00230,Surface Lite,Shoulder claim white might rock prepare us game size.,Apparel,208.96
231,SKU-00231,Group Max,Growth task issue three similar hold decade particular avoid charge physical.,Beauty,347.38
232,SKU-00232,Modern X,Source central that natural why sit beautiful behind.,Beauty,360.01
233,SKU-00233,Former Pro,Value claim evidence guy become condition sign election list.,Electronics,315.46
234,SKU-00234,Establish Plus,Practice cell buy notice always teacher husband tax true can happen suddenly weight.,Beauty,212.3
235,SKU-00235,Hour X,Radio media enjoy then radio per popular scientist.,Beauty,99.99
236,SKU-00236,Election Pro,Account table fact citizen human authority hold left behavior letter politics too let beat rule.,Beauty,311.37
237,SKU-00237,Whose Max,Should current forget fish you main reduce live everything although choose like policy.,Sports,113.54
238,SKU-00238,Front X,All over herself view gun involve list approach test well raise establish player base attorney.,Apparel,141.83
239,SKU-00239,Interview Pro,Fear Republican the modern prove else store begin.,Sports,399.32
240,SKU-00240,Week Lite,Garden send clearly glass industry little read claim recent great realize home act.,Apparel,251.27
241,SKU-00241,Stay Pro,Cup reveal official certain professional statement same stay run add to value material first society purpose.,Electronics,31.74
242,SKU-00242,Everyone Plus,Reveal write wall tax plant police official already second could recent similar over democratic decide.,Electronics,108.75
243,SKU-00243,Cut Plus,Western have hair few film standard by material yourself increase goal stock international wind from.,Home,310.33
244,SKU-00244,With Pro,Learn health need class job expect process quite plant.,Shoes,56.69
245,SKU-00245,Science Max,Visit town between because student bed administration usually billion seek perhaps name plant me south property.,Shoes,92.06
246,SKU-00246,Together Lite,Deep since necessary boy task wear go soldier less traditional population six how.,Shoes,259.88
247,SKU-00247,Yard X,Site medical environment probably film total training pull above training allow ago.,Beauty,362.09
248,SKU-00248,Street Max,Subject million scientist fish color occur involve new hot pattern hotel appear.,Apparel,166.36
249,SKU-00249,Work Plus,Investment vote hospital road idea fish citizen discuss report call brother officer hot several true.,Shoes,118.88
250,SKU-00250,Third Plus,City follow behavior agent activity show check peace myself win occur agent safe work play.,Apparel,117.75
251,SKU-00251,Star Lite,Cost present develop create subject risk southern her employee appear bar century.,Home,435.59
252,SKU-00252,Agency X,Term book until but center energy Congress back suddenly tree debate beyond somebody including main personal.,Beauty,41.4
253,SKU-00253,Develop Lite,Heart finish traditional speak conference act condition note parent all wish year low.,Home,31.9
254,SKU-00254,Positive X,National citizen score unit cover ahead age memory charge term boy describe foreign detail road vote.,Beauty,112.0
255,SKU-00255,Executive Lite,Loss well give necessary family seat many mention hundred cover common.,Electronics,93.14
256,SKU-00256,Right X,Which bill soldier onto close day reveal item land others even.,Apparel,231.58
257,SKU-00257,From Plus,Blue him current good today standard last threat when education important page theory wear most huge.,Apparel,487.9
258,SKU-00258,Building Plus,Speak investment control early Democrat he certain fire act.,Sports,67.97
259,SKU-00259,Rise Max,Response degree nothing focus discussion at exist.,Apparel,34.53
260,SKU-00260,Difference Pro,Design night respond watch space provide off position radio itself spend cup anyone management another.,Home,426.57
261,SKU-00261,Face Lite,Budget laugh over option door again adult situation office above left capital whom.,Electronics,89.74
262,SKU-00262,Although X,Truth although population attorney believe sort rich ever send hundred news finish partner hotel recent.,Beauty,443.77
263,SKU-00263,Look X,Support whose building hear peace ahead answer action black follow reach job color course.,Sports,395.83
264,SKU-00264,Week Max,Staff Mr above read appear third amount answer fight enough reach social.,Beauty,453.26
265,SKU-00265,Hundred Max,Recognize understand on build floor challenge once sure time PM property.,Shoes,428.23
266,SKU-00266,Nearly Lite,Drive long majority exactly significant lot begin she represent good structure drug positive task reason.,Home,429.2
267,SKU-00267,Bad X,Art actually democratic stand could bit decade opportunity month teach set find law child.,Home,297.83
268,SKU-00268,Mother Plus,Trial despite hair window test message sister could.,Home,12.18
269,SKU-00269,Fall X,Clearly film thank possible challenge then seat drive thus cost agreement product laugh.,Home,127.68
270,SKU-00270,Evidence Max,Until base issue character maybe meet apply evening best.,Beauty,115.09
271,SKU-00271,Range X,Rule institution family idea order morning management item race position where detail.,Shoes,457.31
272,SKU-00272,Argue Lite,Offer draw mother every third record identify.,Shoes,490.19
273,SKU-00273,Increase Lite,Detail station reality manager commercial data PM relationship.,Beauty,368.07
274,SKU-00274,Field Pro,Behind me red live figure trade draw.,Home,215.72
275,SKU-00275,Forward Lite,Coach forward lay while program into again window.,Sports,405.81
276,SKU-00276,Upon Pro,Color set act goal listen a their line.,Apparel,228.96
277,SKU-00277,Answer Pro,Note wrong structure moment cold chair behind.,Shoes,281.45
278,SKU-00278,Fly Lite,Laugh same wrong either main hair add good report through simple tax.,Apparel,475.22
279,SKU-00279,Week Plus,Machine establish mind policy challenge improve detail yes ground all officer receive issue deal become turn.,Sports,151.42
280,SKU-00280,Huge Pro,Whole theory quickly tonight last when money enter.,Sports,12.89
281,SKU-00281,Respond Plus,Thousand hospital individual yes finally American mind gas partner item lawyer why.,Home,85.09
282,SKU-00282,Structure Max,Eye wide material rate letter change whom perhaps professor field explain son.,Shoes,374.91
283,SKU-00283,Administration Lite,American executive or apply figure involve produce a edge go exist teacher program shoulder.,Apparel,234.56
284,SKU-00284,Clear Lite,Require central run it truth fact allow usually.,Electronics,96.55
285,SKU-00285,Energy Lite,Institution whom better end few financial nor quickly follow official raise current career.,Shoes,353.43
286,SKU-00286,Once Pro,Feeling beat note pick national heavy then join catch kind.,Sports,195.52
287,SKU-00287,Form Plus,Various Republican life into inside improve agree next whatever inside sense past few drug.,Electronics,267.81
288,SKU-00288,Music Lite,Camera myself not fall sense hotel idea accept space themselves least approach.,Sports,377.68
289,SKU-00289,Around Max,Stop practice four best fact loss former article science purpose school.,Apparel,273.51
290,SKU-00290,Argue Pro,Might no whose carry time policy choice pick rest view.,Electronics,312.13
291,SKU-00291,Support Pro,Perhaps customer attack check they mind easy billion agency media hospital unit feel low.,Sports,259.79
292,SKU-00292,Create Plus,Success national start race teacher pay it player continue stand.,Shoes,444.55
293,SKU-00293,Really Lite,Color score national live face property where manage property hospital.,Beauty,185.97
294,SKU-00294,Save Pro,Less spend challenge exist build hope oil alone.,Apparel,185.96
295,SKU-00295,Rather Max,Know traditional great cause think learn across citizen may technology decision total modern message company charge.,Beauty,353.91
296,SKU-00296,Reality X,Fund resource skill everything several field hour trouble population heavy line probably office until simple.,Electronics,73.51
297,SKU-00297,Never X,Can food western give pay identify and system city benefit blood.,Sports,272.12
298,SKU-00298,World Lite,Food discuss sign true somebody black thing rock himself wind two artist economy also.,Beauty,370.0
299,SKU-00299,So X,Kid hear piece ahead company blue last card.,Apparel,377.82
300,SKU-00300,Public Plus,News cultural make quickly different score its more so beat agency where benefit almost cell.,Electronics,179.59
301,SKU-00301,Accept Max,Similar nothing ten future radio whatever rock month couple debate still may.,Electronics,341.71
302,SKU-00302,Heavy Pro,Tonight table soon keep personal them notice camera military beyond material anything music against start face.,Electronics,36.37
303,SKU-00303,Them Lite,Hospital group their citizen explain move drop military particularly fine peace.,Beauty,245.68
304,SKU-00304,Office Pro,Old view world president allow instead customer thousand.,Beauty,237.73
305,SKU-00305,Artist Max,Daughter stage form serious treatment artist management south nor.,Home,450.23
306,SKU-00306,Poor Max,Generation audience indicate school upon thought long.,Sports,187.23
307,SKU-00307,Carry Pro,Rich bit market different go local sit theory direction use ago.,Home,98.24
308,SKU-00308,Station Pro,Move team radio scene need appear she receive involve interview.,Apparel,44.68
309,SKU-00309,Certainly Plus,Just today work happy create job around discussion.,Shoes,479.34
310,SKU-00310,Per Pro,Dinner section thousand soldier nothing yard address.,Shoes,86.56
311,SKU-00311,Service X,Spend baby camera Congress analysis glass pretty each factor paper.,Apparel,250.68
312,SKU-00312,Measure Max,Prevent baby voice day relate spend today teach kitchen.,Shoes,476.29
313,SKU-00313,Five Plus,Sister fall president money environment recently me approach too relationship perform evidence.,Sports,211.19
314,SKU-00314,Democrat Max,Success minute figure need but right small along dog.,Home,466.2
315,SKU-00315,Less Plus,Well again student establish open feel whole arrive take himself affect him know difference.,Sports,212.96
316,SKU-00316,Hundred Pro,Process mouth produce all several visit travel senior from.,Shoes,149.3
317,SKU-00317,Them Pro,Special opportunity serious game stop its into role save arm body.,Apparel,436.54
318,SKU-00318,Important Max,Teach visit less occur nothing million class high second under car.,Home,324.11
319,SKU-00319,Administration Max,Son week beat economic myself front house past gun process site.,Sports,174.68
320,SKU-00320,Take Plus,Activity fill produce structure summer kitchen admit across already grow point news impact often bag today.,Sports,245.64
321,SKU-00321,Ok Max,Well key election skill employee manager dinner company that pretty discussion pressure.,Home,421.74
322,SKU-00322,Create Lite,Team oil among response article research else either question tax government responsibility over glass.,Apparel,155.52
323,SKU-00323,Bank Plus,Kitchen memory down for he state indeed politics then central force small friend impact.,Electronics,90.01
324,SKU-00324,Reach X,Likely wind perform civil and us treatment agent participant space member sit.,Electronics,244.7
325,SKU-00325,Movie Pro,Require vote her old price change several power western when yeah not young piece safe much.,Electronics,78.43
326,SKU-00326,Campaign Lite,Sometimes parent process minute first crime offer treat forget sometimes within discuss fire win realize.,Beauty,478.33
327,SKU-00327,Light X,Gun goal measure trip president painting large industry notice step by Mrs simply.,Electronics,357.35
328,SKU-00328,Involve X,Program painting somebody game brother impact measure chance management thing cup conference law coach industry she.,Sports,486.74
329,SKU-00329,Seek X,Sea call alone issue real wrong car term truth toward great I news Republican.,Shoes,84.82
330,SKU-00330,By Pro,Today together option pattern yes and school great large important last strong.,Beauty,496.92
331,SKU-00331,Figure X,Record safe rich operation star meeting charge account or purpose law fly computer reveal.,Electronics,223.24
332,SKU-00332,Far X,Discussion manage answer military modern meet up expect.,Sports,106.55
333,SKU-00333,If Pro,Serious well among war think room issue everything they fire girl close.,Electronics,334.45
334,SKU-00334,Field X,Main difference college voice else paper blood discuss everything benefit need.,Beauty,189.59
335,SKU-00335,Movie X,Agree total whether music sometimes according strategy ago data.,Shoes,269.15
336,SKU-00336,Year Pro,Interview know call law truth respond try build threat manage beautiful carry everything protect why.,Home,205.26
337,SKU-00337,Suggest X,Season develop avoid church friend law save public.,Electronics,474.16
338,SKU-00338,Back X,Throughout although beyond relate miss couple newspaper study personal we physical early.,Sports,7.13
339,SKU-00339,Peace Max,The detail cultural like machine cost market capital play become might rich.,Electronics,487.92
340,SKU-00340,Difficult Plus,Its make particularly report although read party.,Electronics,239.59
341,SKU-00341,Program Max,Doctor give most west there subject themselves property make picture our myself far despite while to.,Beauty,335.11
342,SKU-00342,South Lite,Information language easy interesting computer what produce girl huge campaign think.,Shoes,172.65
343,SKU-00343,Though Lite,Over reach ahead environmental Democrat surface important no follow push in speak interesting end.,Apparel,450.59
344,SKU-00344,Arm Max,Magazine despite player animal language determine then movie single book why.,Shoes,62.85
345,SKU-00345,Popular Lite,Can music wear again here sister four good she as any decision.,Apparel,310.67
346,SKU-00346,North Lite,World study how responsibility face claim hear including need eat.,Electronics,181.91
347,SKU-00347,Add Pro,Suddenly sense money may social amount executive.,Apparel,306.03
348,SKU-00348,Agent Max,Place read almost seek spend help husband stand theory technology.,Electronics,265.58
349,SKU-00349,Ball X,Mean region run after sea must try believe.,Beauty,16.16
350,SKU-00350,Per Lite,Create paper fine food mention age ever dark enough prevent likely fact behavior.,Shoes,340.15
351,SKU-00351,Investment Max,Everything expect reflect media him year road week several research laugh official agent side language.,Home,200.24
352,SKU-00352,Me Plus,Board financial century picture base night debate walk order base idea study model style set.,Beauty,303.57
353,SKU-00353,Artist Pro,Edge find full character focus north image accept real sense some nation fine present.,Electronics,454.68
354,SKU-00354,Fund Lite,Remember method teach yeah bank bit recognize heart series class security coach join will.,Home,78.23
355,SKU-00355,American Plus,Manager phone modern cause them industry across brother yet result they even follow.,Shoes,196.13
356,SKU-00356,Visit Plus,Nor coach face rate sort weight he page line decision form section.,Electronics,175.74
357,SKU-00357,Together Lite,Clearly resource listen fish conference like year accept reduce.,Shoes,437.78
358,SKU-00358,Decision X,Mrs former article light choose go next difficult.,Home,365.29
359,SKU-00359,Production Lite,Until ever star test once figure person.,Electronics,402.82
360,SKU-00360,Interesting X,Night political dark or bill describe condition nor camera mission population.,Home,403.81
361,SKU-00361,Identify Lite,Offer table painting whom say pattern training decide able discussion describe upon.,Beauty,74.09
362,SKU-00362,Possible Max,Century little a back wide case southern international line.,Apparel,47.61
363,SKU-00363,Five Plus,Service drive hotel similar relationship great stuff first back painting degree coach plant everyone.,Beauty,239.93
364,SKU-00364,Character Plus,Night majority smile rate newspaper itself give agent hand letter prove rock degree.,Beauty,37.73
365,SKU-00365,Opportunity Lite,Him condition section action kind moment accept financial behind hard.,Home,48.78
366,SKU-00366,Environment Plus,Tv parent almost ever long analysis receive education personal wife statement tell until young.,Beauty,210.18
367,SKU-00367,Project Lite,Make list themselves seek space although ahead thus check save that capital information suffer.,Apparel,356.57
368,SKU-00368,Arrive X,Pm artist best name work create pass admit student summer first remember town.,Home,97.07
369,SKU-00369,Peace Plus,Might wait idea study prove assume stay may rock base kitchen every.,Shoes,279.16
370,SKU-00370,Decide Plus,Important play success wait find night brother letter structure beat us because truth consumer.,Electronics,418.12
371,SKU-00371,Before Lite,Fish phone after college action point least theory wall.,Home,281.84
372,SKU-00372,Foot X,Section scene financial here expert everything north including structure evening.,Shoes,18.29
373,SKU-00373,Decision X,Without else keep begin great hair sign mission stop.,Sports,135.03
374,SKU-00374,Right Lite,Already strong history Mrs decision reduce get specific someone.,Sports,66.47
375,SKU-00375,Despite Plus,Record mean stop some before significant election life all boy probably cost.,Home,211.49
376,SKU-00376,Challenge X,Only head help open almost red picture thank account instead friend possible beyond tree.,Electronics,19.08
377,SKU-00377,Follow Lite,Level control against speak lead office itself human street.,Shoes,497.19
378,SKU-00378,Entire Max,Over lot husband always upon doctor various until blue international especially officer.,Beauty,374.05
379,SKU-00379,Personal Lite,Clearly coach feel others recently model week.,Electronics,284.96
380,SKU-00380,Out Lite,Candidate four whether wife finally she soon learn close.,Shoes,487.26
381,SKU-00381,A Plus,Customer common film continue tax job right child new.,Beauty,258.7
382,SKU-00382,Stand Pro,Above city beyond near hour defense line heavy less drug true hold.,Apparel,423.41
383,SKU-00383,Friend Max,Hundred force executive push their others move get prove.,Electronics,33.96
384,SKU-00384,Peace Lite,Develop part should hard fund statement particular.,Apparel,439.77
385,SKU-00385,Society Plus,Trip population catch could deep itself fund pressure international expect hit start alone.,Electronics,85.84
386,SKU-00386,Know Plus,Clear radio strong let bar rather big television sound.,Electronics,212.66
387,SKU-00387,Actually Pro,Five offer himself lawyer main whether I side field.,Beauty,148.48
388,SKU-00388,Evening Pro,Page sort late health list friend movement half.,Sports,259.36
389,SKU-00389,Stock X,Wonder mother himself push character front various opportunity culture.,Beauty,383.52
390,SKU-00390,Tax X,Road lawyer any example business majority happen threat rather education front fast standard myself condition ground.,Electronics,274.14
391,SKU-00391,Adult Plus,Foot player other ground already school eat base behind risk plan issue ever will.,Sports,139.37
392,SKU-00392,Risk Plus,Each stay strong run model learn baby head chair with point think high woman bad until.,Beauty,52.44
393,SKU-00393,So Plus,Institution against wear either present third student item bring court end.,Shoes,412.54
394,SKU-00394,Floor X,Method take during sometimes hear list set join section sing everybody provide painting travel question evening.,Electronics,261.49
395,SKU-00395,Investment Lite,Affect increase candidate environment out wish fish determine adult foot.,Apparel,208.94
396,SKU-00396,Attack Pro,Explain Republican step onto play forget home upon actually future get know left sea decision recently.,Beauty,112.85
397,SKU-00397,Report X,Eight allow system whose place no generation debate world hard factor firm purpose.,Beauty,416.63
398,SKU-00398,All Max,Person coach goal it yet age wind news make.,Beauty,346.38
399,SKU-00399,Easy Max,Tv capital parent sure best design yeah number condition city since same.,Sports,357.71
400,SKU-00400,Institution Pro,Impact seem industry out floor guy black those whether seven fish movie hot teacher manager.,Shoes,211.59
401,SKU-00401,Majority Pro,Step last under concern eye mouth free less common trade himself.,Shoes,410.33
402,SKU-00402,Read Lite,Wind improve player peace catch people your outside rule watch foot economic notice.,Sports,177.36
403,SKU-00403,Marriage Plus,Weight age over smile hope memory cover tree.,Home,73.81
404,SKU-00404,Lot Max,Rich dream line require current car ask air officer learn raise kitchen.,Electronics,263.94
405,SKU-00405,Effort X,Win matter book page former turn city left while.,Shoes,356.4
406,SKU-00406,Account Pro,Radio image mind like history situation whatever.,Sports,115.07
407,SKU-00407,Use X,Building since positive move agency lose rise fall huge state shoulder guy respond memory power.,Electronics,345.58
408,SKU-00408,Later X,Billion suggest serious often social reveal hand prevent center.,Shoes,108.87
409,SKU-00409,Eight Lite,Decide best politics available tonight man each employee far know skin record nothing organization.,Shoes,346.95
410,SKU-00410,Sort Pro,Challenge eye determine he guy fact war citizen plant.,Home,14.31
411,SKU-00411,May Lite,Pull child source campaign parent teacher either direction surface on chance activity hair.,Shoes,26.05
412,SKU-00412,Movie Pro,Image peace color general choose system fire hear tend magazine college moment compare today add.,Beauty,397.56
413,SKU-00413,Your Max,Garden finally difference everything sing smile practice ground.,Shoes,34.34
414,SKU-00414,Machine Plus,Tree trade style suffer situation model direction dark professional huge better forget attack network movement.,Electronics,26.42
415,SKU-00415,Site Pro,Their wife argue note easy eight school ready practice each ready lay American participant necessary.,Shoes,378.5
416,SKU-00416,Benefit Max,Safe true town car few debate during seven local better.,Apparel,106.67
417,SKU-00417,Upon X,Five plant cultural bring bar culture my.,Shoes,336.95
418,SKU-00418,Dinner Pro,Maintain notice ok technology born though since crime south pass lead a senior over manage computer.,Sports,77.05
419,SKU-00419,Movement Plus,Method week federal test eat every night final key with watch maintain five window.,Electronics,474.65
420,SKU-00420,Many Plus,Clear assume it fight understand kitchen point Mrs consumer single several degree maybe floor.,Beauty,84.48
421,SKU-00421,Nice Max,Bill feel participant number choice choose short skill system particular church what wonder president.,Beauty,124.7
422,SKU-00422,Story Pro,Sister especially usually line task field certain free government seat last interesting hour.,Beauty,54.06
423,SKU-00423,Key Pro,Several identify why government south window short.,Sports,266.78
424,SKU-00424,After X,Decade respond far health focus so for nice current Democrat.,Apparel,482.31
425,SKU-00425,Most Max,Task blood during for look return like wife animal process reach training main.,Sports,7.14
426,SKU-00426,Far Pro,Only arrive argue garden Mrs just exist line thing available with run station them operation off.,Beauty,462.49
427,SKU-00427,Or Lite,Just foreign national produce news stage ready cell.,Beauty,186.4
428,SKU-00428,Speech X,That recognize school whatever guess significant section Democrat.,Shoes,222.63
429,SKU-00429,Full X,Direction gun current will else page usually cell politics interview south something story art.,Home,418.2
430,SKU-00430,Music Lite,Administration join allow mean sometimes so man offer plant same north wind.,Apparel,111.07
431,SKU-00431,Statement Lite,Mother sometimes suffer because two particular year sell.,Electronics,60.86
432,SKU-00432,Speak Pro,Stand letter threat yes charge form consider offer law sit science way threat.,Beauty,235.62
433,SKU-00433,Interest X,Family perhaps hope across follow character talk once should mother president customer start understand throw.,Electronics,250.43
434,SKU-00434,Senior Plus,Check significant deal consider ago own suddenly single music west force firm discover decade field.,Shoes,280.78
435,SKU-00435,Language Pro,Do turn sign agree there want but way agent test take.,Shoes,167.42
436,SKU-00436,Detail Lite,Any just cup side opportunity by wide medical official might clear decide.,Beauty,145.39
437,SKU-00437,Yeah Plus,Scientist group yet indeed decision before medical long meet war administration herself information which.,Home,345.09
438,SKU-00438,Black X,Growth finally assume watch present director red practice special then administration who.,Electronics,279.19
439,SKU-00439,Show Lite,Animal suggest concern act million cell like although other decide science fall.,Shoes,98.45
440,SKU-00440,Prepare Lite,Statement information company million character speak protect half understand skill air daughter idea.,Electronics,469.85
441,SKU-00441,Hour X,Perform agreement ago agreement like same certain imagine much several reveal.,Sports,11.33
442,SKU-00442,Condition Lite,Beyond give development information at why less indeed together.,Home,337.69
443,SKU-00443,Less Lite,Tax speak a live tonight either follow music whatever.,Sports,263.72
444,SKU-00444,Relate Pro,Local see system cultural despite candidate walk difficult.,Home,64.01
445,SKU-00445,Beautiful Lite,Response executive past economic economy role feeling report.,Shoes,349.04
446,SKU-00446,Maintain X,Mind officer third service capital instead product often various alone town his answer cup consider central.,Apparel,37.03
447,SKU-00447,Along Plus,Class follow occur low gas pick stage officer later Democrat.,Home,104.13
448,SKU-00448,Pretty Pro,National brother evidence shoulder under front throughout effort southern maintain nature.,Home,120.27
449,SKU-00449,Record Lite,Property garden mind as half politics who call.,Sports,142.87
450,SKU-00450,Dream Max,Store build require call girl laugh network vote whom will consumer star those memory.,Sports,298.86
451,SKU-00451,Change Lite,Simply cup seat moment sister none most another mouth much.,Sports,181.27
452,SKU-00452,Rule Max,Coach city quite play teacher difficult us respond must western interest dark any wide husband.,Home,475.32
