product_id,sku,name,description,category,price
453,SKU-00453,In Max,Will throw life carry visit a edge new find type party where arrive improve century.,Home,143.05
454,SKU-00454,Test Pro,Share southern week drug skill position hospital cover strong.,Home,65.48
455,SKU-00455,Avoid Lite,White everybody throughout but science want charge kitchen public set.,Apparel,119.26
456,SKU-00456,Activity Pro,Minute modern sign out discussion just state must particular.,Shoes,54.3
457,SKU-00457,Class Pro,They senior result themselves we American study eight.,Shoes,251.58
458,SKU-00458,Produce X,International collection report tend maintain fact mission become rule where ten drop sure manager.,Sports,194.4
459,SKU-00459,Science Plus,Instead point tend exactly right every edge meet information student work bar big.,Beauty,80.6
460,SKU-00460,Sure Max,Drug manager opportunity program billion sit remain night study heart million understand him own.,Shoes,52.69
461,SKU-00461,Performance Max,Offer brother shake guess pull tough instead hour.,Home,384.95
462,SKU-00462,Size X,Girl small system of mission vote spend.,Home,150.31
463,SKU-00463,Production Lite,Protect agent note agency watch better turn soon rock support effect stand general.,Beauty,254.87
464,SKU-00464,Energy Plus,Land answer leader yard enjoy soldier decide side natural focus husband.,Beauty,405.69
465,SKU-00465,Happen Max,Suddenly task free pattern science structure dinner stock big.,Shoes,13.75
466,SKU-00466,Seven Lite,Police fine market control him enter religious go.,Shoes,440.66
467,SKU-00467,Sure Lite,Time senior where follow born ok training record night series Mrs huge receive.,Home,227.81
468,SKU-00468,Decide Lite,Bed our theory identify enjoy respond mouth however.,Shoes,232.53
469,SKU-00469,Will X,Billion what sport thought family now bank yourself kind American nature property event.,Electronics,280.55
470,SKU-00470,Miss X,Street work early difficult possible democratic actually during again partner.,Apparel,248.28
471,SKU-00471,This Plus,Increase necessary nothing include summer ok physical thousand without section religious word sound.,Home,359.28
472,SKU-00472,Everyone Pro,Have tonight view floor ground when care team worry east Mrs can wonder.,Home,286.58
473,SKU-00473,Still Max,Remain movement bit step direction give reduce with start difference especially student least just.,Beauty,344.26
474,SKU-00474,Perhaps Lite,Ask yet against large practice time live relationship as great western everybody edge.,Apparel,240.58
475,SKU-00475,Watch Max,Require make region wall worry Democrat laugh.,Electronics,32.59
476,SKU-00476,Nothing Lite,Form now then watch certain much race fire according participant Republican.,Home,297.57
477,SKU-00477,Help Max,Build within pass morning room run eat own serve conference Congress power manager build become watch.,Electronics,339.86
478,SKU-00478,Painting Plus,Source high listen suggest consumer find concern involve edge before employee customer goal.,Beauty,35.4
479,SKU-00479,Radio Pro,Fund sell model after paper word arrive health.,Electronics,68.46
480,SKU-00480,Concern Plus,White more above his agree toward nor.,Beauty,405.73
481,SKU-00481,Town Pro,Western country per consider despite generation the tree.,Sports,383.77
482,SKU-00482,Plan Plus,Off through relationship they concern chance standard air although Mr when wait.,Home,193.38
483,SKU-00483,Surface Plus,Various blue raise operation cold between cover choice party front lawyer.,Home,496.01
484,SKU-00484,Reason Plus,Story six want protect assume east center whether make some among around word lose such.,Apparel,32.94
485,SKU-00485,Receive X,Better mind professional fly month offer mother hour national cut fly language cup want international itself.,Electronics,121.14
486,SKU-00486,Beautiful Max,Agency bit night participant fill yeah side side recognize month among water film onto.,Sports,47.05
487,SKU-00487,We Pro,Myself political school move another field could who appear stay them school model condition he.,Shoes,435.13
488,SKU-00488,Say Plus,Treat better wear throughout Republican authority data.,Beauty,89.04
489,SKU-00489,Design Plus,Policy administration two deal ready under above drive sport story worker would step head study.,Sports,23.5
490,SKU-00490,Another Lite,Center east protect think institution now tell phone daughter.,Home,286.18
491,SKU-00491,Unit Plus,Important act statement help successful couple single effect action realize among.,Home,15.1
492,SKU-00492,Speak Max,Can ready audience boy city social at Mr cold science western resource reason expect.,Electronics,16.01
493,SKU-00493,Few Lite,Talk end set house those dark beat suffer customer million along.,Electronics,287.33
494,SKU-00494,Measure Max,Born also hold base really attack job he.,Home,53.37
495,SKU-00495,Single Pro,Kind shoulder production mean window shoulder right analysis add.,Apparel,346.98
496,SKU-00496,Claim Plus,Teacher economy compare left top argue herself water measure different physical from.,Sports,250.88
497,SKU-00497,Set Plus,Agent key successful own explain claim natural fish born assume million admit result.,Electronics,87.48
498,SKU-00498,Shake Plus,Have century billion do high none sport shoulder build different pick nor.,Apparel,484.87
499,SKU-00499,Back Lite,Power treat visit population executive pattern last.,Shoes,319.54
500,SKU-00500,Smile Max,Raise partner generation write lawyer try check movie growth certain.,Electronics,110.97
